{
  "schema_version": "pfn.v1",
  "event_id": "11111111-1111-4111-8111-111111111111",
  "trace_id": "22222222-2222-4222-8222-222222222222",
  "task_id": "33333333-3333-4333-8333-333333333333",
  "command_id": "44444444-4444-4444-8444-444444444444",
  "target_node_id": "CTRL-ESP32-ACT-01",
  "target_device_id": "SERVO-DOOR-01",
  "action": "set_position",
  "parameters": {
    "position_degrees": 90
  },
  "issued_at_ms": 1788278400000,
  "expires_at_ms": 1788278410000,
  "attempt": 1
}
